{
  "leaf_spki": "5f9a65f3f0e081395f1a9b23b497cb003a89094038480373e3a9856f7ef0cf43",
  "subject_cn": "api.github.com",
  "profile": "chromium-current",
  "status": "NO_TRUSTED_PATH",
  "earliest_failure": "2026-10-29T10:52:15.115755+00:00",
  "days_until_failure": 0,
  "cause": "missing_trust_anchor",
  "alternative_paths": 0,
  "witness_path": [],
  "proof_hash": "821ca82ee65d5ae86cba8126c50129a1908ab98d5a9f7108d1abe92437a98767"
}