{
  "leaf_spki": "43e8bbcf28b939fa9857d422119eb429dc0a7a39d89264c483a31c62f3a6125a",
  "subject_cn": "mesh.internal.node",
  "profile": "chromium-current",
  "status": "NO_TRUSTED_PATH",
  "earliest_failure": "2026-10-30T10:50:17.327717+00:00",
  "days_until_failure": 0,
  "cause": "missing_trust_anchor",
  "alternative_paths": 0,
  "witness_path": [],
  "proof_hash": "93bff9ecad828ef93dea9a2df32e6aa71ed17fb7b0ab07000fc058c12a8ac9cd"
}