{
  "leaf_spki": "129038fbcd5839217830aaefbbccddeeff99332211445566778899aabbccdde0",
  "subject_cn": "legacy-device.internal",
  "profile": "chromium-current",
  "status": "NO_TRUSTED_PATH",
  "earliest_failure": "2026-10-27T09:47:08.188577+00:00",
  "days_until_failure": 0,
  "cause": "missing_trust_anchor",
  "alternative_paths": 0,
  "witness_path": [],
  "proof_hash": "8c78d9ad05799c86d649aa96490894df7adb7b6ce57469eae7b11c66ddafd313"
}